"id","project_name","project_code","sg_id","lead_user_id","description_short","description","start_year","end_year","is_private_sensor","is_private_tag","is_private_project","tags_permissions","sensors_permissions","access_level","status","backup_id","last_edited_dt","last_edited_user_id","created_dt","fee_id","securable_bin","cite_by"
0,"Motus Test Project","NO_PROJ",,51,"This project should be used to verify functional updates within the live database environment",,2014,,0,0,1,0,0,0,,,5/20/2021 14:06:39,,1/1/2014 0:00:00,9,,1
1,"Motus Ontario Array","MotusON",,2,"Array of ~100 towers maintained by Bird Studies Canada in support of all projects.","Array of ~100 towers maintained by Bird Studies Canada in support of all projects.",2015,2021,0,0,0,2,2,3,,,7/15/2021 11:10:23,,1/1/2014 0:00:00,9,1,1
2,"Motus Atlantic Array","MotusATL",,547,"Array of 50+ towers maintained by Bird Studies Canada in support of all projects.","Array of 50+ towers maintained by Bird Studies Canada in support of all projects.",2014,,0,0,0,2,2,3,,,6/3/2021 16:56:35,,1/1/2014 0:00:00,1,,1
3,"EC-Quebec-St.Laurent","Quebec",,233,"Shorebird projects based along the St.Lawrence river.
PI: Yves Aubry (Environment Canada)","Details to come.",2014,2019,0,0,0,2,2,3,,,5/20/2021 14:06:39,,1/1/2014 0:00:00,3,,1
4,"Region 4 USFWS  ","USFWS_R4",,351,"Motus stations operated by Region 4 USFWS National Wildlife Refuge System.","Currently, this project houses all Motus stations operated by the Region 4 (Southeast) U.S. Fish & Wildlife Service National Wildlife Refuge System.",2015,2020,0,0,0,2,2,3,,,5/20/2021 14:06:39,,1/1/2015 0:00:00,2,,1
5,"Available","Avail",,2,"This project is available.",,2014,,0,0,0,2,2,3,,,5/20/2021 13:54:39,,1/1/2014 0:00:00,,,1
6,"Panama Gateway ","Panama",,2,"Four towers across the canal zone of Panama maintained for all to benefit by Panama Audubon and Bird Studies Canada.","Four towers across the canal zone of Panama maintained by Panama Audubon and Bird Studies Canada in collaboration with the Smithsonian Tropical Research Institute, The Canopy Tower and Canopy Tower Family, and City of Panama.",2016,,0,0,0,2,2,3,,,5/20/2021 13:54:39,,1/1/2016 0:00:00,,,1
7,"Welch","Welch",23,250,"Maine Coastal Islands National Wildlife Refuge has been tagging common and Arctic terns on a number of breeding colonies in Maine since 2012.","The USFWS, Maine Coastal Islands NWR has been tagging common and Arctic terns on five breeding colonies in Maine over the past four years. In 2012-13, we tagged terns on Petit Manan Island. In 2014-15, we tagged terns on Metinic, Matinicus Rock, and Seal Islands. We also tagged a small number of common terns on Ship Island in 2014.  Our objectives are to determine foraging behavior of incubating and chick-rearing terns (i.e. number of foraging trips per day, length of foraging trips, flight direction of foraging trips, and daily patterns of activity). WE want to compare foraging patterns between incubation and chick rearing terns. Ideally we would like to identify foraging locations but the offshore location of breeding colonies does generally not allow for nearby towers. We are also using data collected after the terns disperse from the colonies to identify migration pathways and staging areas.",2014,2015,0,0,0,2,2,3,,,5/20/2021 14:06:39,,1/1/2013 0:00:00,2,,1
8,"Holberton 2013-14","HolbSESA",12,242,"In 2013-14, we tracked movements of ~ 75 Semipalmated Sandpipers in Downeast Maine to better understand stopover habitat use.","We applied nanotags to Semipalmated sandpipers (30 SESA + 4 ""other"" in 2013; 41 SESA in 2014) captured on stopover during fall migration in the Narraguagus Bay area in Downeast Maine.  This region is primarily active with fish, lobster, and shellfish harbesting, and represents a relatively undisturbed area compared to coastal areas in southern Maine that are heavily used by beach-goers. Birds were captured on feeding areas (mudflats) via passive mistnetting during low tide, and at roost sites on offshore rock ledge by hand-held rocket netting from a small boat during high tide. All tagged SESAs were subsequently detected and showed regular, tide-cycle-dependent movements between feeding areas along the rivers leading into Narraguagus Bay and offshore ledge roost sites.  In general, juvenile (HY) birds were more likely to be in lower body condition (fat-free mass) compared to adults and showed a longer post-deployment period leading to departure than adults did. A significant finding in this study is the confirmation that birds staging in this area depart directly from it to embark on a trans-oceanic flight to Central/So America.  In both years, none of the SESAs tagged at this site were detected in areas to the north/east or south.  This is in contrast to birds tagged on stopover in southern Maine and illustrates the importance of the Downeast sites in supporting efficient migration.  In 2015-16, this project will move to southern Maine to investigate stopover behavior at two areas of high human activity to compare within-site movements, stopover period, and departure decisions of these birds to those Downeast, and to determine currently unknown feeding and roosting sites.",2013,2014,0,0,0,2,2,3,,,5/20/2021 14:06:39,,1/1/2013 0:00:00,,,1
9,"Parker River/Great Bay Refuge","Pau",21,104,"Bat, shorebird, and saltmarsh sparrows nanotag projects in northeast MA and southern NH.  Originally 3 towers at Parker River NWR, 2 at Great Bay NWR.","Tower Deployment –
Originally three towers at Parker River National Wildlife Refuge and two towers at Great Bay National Wildlife Refuge. 
Due to maintenance issues and declining capacity, only one tower is currently operational (at the Salt Pannes site at Parker River National Wildlife Refuge).
A second tower will be added at Parker River National Wildlife Refuge in 2021 with CTT detection capability.


Tag Deployment –
Shorebirds work: 2013 (30 SESA), 2014 (23 SESA), 2015 (8 SESA)
Bat work: 2014(10 bats), 2015 (8 bats); 2016 
Sparrow work: 2014 (6 SALS), 2015(17 SALS); 2016 ",2013,2016,0,0,0,2,2,3,,,5/20/2021 14:06:39,,1/1/2013 0:00:00,2,2,1
10,"Taylor - receivers","Taylr",6,103,"Receiver array as part of projects related to Dr. Phil Taylor","Receiver array as part of projects related to Dr. Phil Taylor",2013,,0,0,0,2,2,3,,,5/20/2021 13:54:39,,1/1/2013 0:00:00,,,1
11,"Peterson","Peter",18,246,"Migratory Bat pilot project in Maine.","Migratory Bat pilot project in Maine.
Trevor Peterson - Stantec Bats",2013,2015,0,0,0,2,2,3,,,5/20/2021 14:06:39,,1/1/2013 0:00:00,,,1
12,"Smetzer","Smetzer",,226,"Red-eyed vireos and blackpoll warblers stopover and migration at Petit Manan Wildlife Refuge in Steuben Maine. ","Songbird migration and implications for offshore wind development. 
We outfitted red-eyed vireos and blackpoll warblers with nano tags at the Petit Manan Wildlife Refuge in Steuben Maine. We are tracking the birds to help inform responsible siting and operation of wind farms in the Gulf of Maine. 

Red-eyed vireos and blackpoll warblers stopover and migration at Petit Manan Wildlife Refuge in Steuben Maine. 

We outfitted red-eyed vireos and blackpoll warblers with nano tags at the Petit Manan Wildlife Refuge in Steuben Maine. We are tracking the birds to help inform responsible siting and operation of wind farms in the Gulf of Maine. See Project Smetz

Jenny Smetzer - UMASS",2014,2014,0,0,0,2,2,3,,,5/20/2021 14:06:39,,1/1/2013 0:00:00,,,1
13,"Semipalmated Sandpipers in the Bay of Fundy","SESA BOF",14,216,"Semipalmated Shorebird stopover and migration ecology in the Bay of Fundy.","Diana Hamilton - Mount Allison University
Julie Paquet - Environment Canada",2012,2014,0,0,0,2,2,3,,,5/20/2021 14:06:39,,1/1/2013 0:00:00,,,1
14,"Loring","Loring",10,230,"Concurrent projects on tern and shorebird movements throughout the Atlantic Coast","Concurrent projects on tern and shorebird movements throughout the Atlantic Coast",2013,2019,0,1,0,0,0,0,,,7/14/2021 13:52:45,,1/1/2013 0:00:00,2,2,1
15,"Aubry","Aubry",1,233,"Stopover and Migratory behaviour of migratory birds along the St.Lawrence River - Swainson's Thrush, Pine Siskin, as well as some shorebirds.","Stopover and Migratory behaviour of migratory birds along the St.Lawrence River - Swainson's Thrush, Pine Siskin, as well as some shorebirds.
Yves Aubry - Environment Canada - Quebec",2014,,0,0,0,2,2,3,,,5/20/2021 13:54:39,,1/1/2014 0:00:00,,,1
16,"Boyles","Boyles",26,257,"Bat migration and ecology in the mid-west.","Bat migration in the mid-west.
Dr. Justin Boyles - Southern Illinois U
",2014,2015,0,0,0,2,2,3,,,5/20/2021 14:06:39,,1/1/2014 0:00:00,,,1
17,"Chapman","Chapman",29,258,"Shoals_2014                    ","Shoals_2014   ",2013,2014,0,0,0,2,2,3,,,5/20/2021 14:06:39,,1/1/2014 0:00:00,,,1
18,"Dossman_Ohio","Dossman",5,205,"Migration, stopover ecology, and departure decisions of American Redstart, Magnolia and Myrtle warblers in north east Ohio.","Migration, stopover ecology, and departure decisions of American Redstart, Magnolia and Myrtle warblers in north east Ohio.
Bryant Dossman - Ohio State",2014,2015,0,0,0,2,2,3,,,5/20/2021 14:06:39,,1/1/2013 0:00:00,,,1
19,"Dossman_Jamaica","Jamaica",,205,"Movement and space-use during the non-breeding season and migration.",,2016,2020,0,0,0,2,2,3,,,5/20/2021 14:06:39,,1/1/2015 0:00:00,1,,1
20,"Gugli","Gugli",8,240,"A slough of projects dealing with migration and stopover ecology of migratory songbirds and bats at Long Point and throughout Canada.","A variety of projects dealing with migration and stopover ecology of migratory songbirds and bats at Long Point and throughout Canada.
Chris Guglielmo & Yolanda Morbey - Western University",2014,2021,0,0,0,2,2,3,,,8/29/2021 18:43:03,,1/1/2013 0:00:00,1,2,1
21,"Taylor - Gull","TaylorGull",,103,"Gull work on Sable Island 2013","Gull work on Sable Island 2013",2013,2013,0,0,0,2,2,3,,,5/20/2021 14:06:39,,1/1/2013 0:00:00,,,1
22,"Taylor - Ipswich Sparrow","TaylorIPSP",,103,"Ipswich Sparrow survival and migratory behaviour","Ipswich Sparrow survival and migratory behaviour on Sable Island
Zoe Crysler and Dr. Phil Taylor - Acadia University 2013/2014
Lucas Berrigan and Phil Taylor - Acadia University 2016-2017
Survival and migratory behaviour of Ipswich sparrows on Sable Island, Nova Scotia. Lucas Berrigan and Phil Taylor at Acadia University 2016/17",2013,2019,0,0,0,2,2,3,,,5/20/2021 14:06:39,,1/1/2013 0:00:00,1,,1
23,"Motus","MotusAdmin",30,2,"General project administration - mostly test tags.","General project administration - mostly test tags.",2021,2021,0,0,0,2,2,3,,,5/20/2021 14:06:39,,1/1/2014 0:00:00,,,1
24,"Norris","Norris",9,259,"White-throated Sparrow orientation and migration studies.","White-throated Sparrow orientation and migration studies.
Dr. Ryan Norris, Dr. Dmitry Kishkinev - University of Guelph",2014,2014,0,0,0,2,2,3,,,5/20/2021 14:06:39,,1/1/2013 0:00:00,,,1
25,"obrien","R5_SALS",20,248,"Shorebird work on the Gulf of Maine.  Saltmarsh Sparrow migration project.  ","Sparrow and shorebird work on the Gulf of Maine.
Kate OBrien - USFWS
Kate OBrien's Saltmarsh Sharptailed Sparrow project at Rachel Carson NWR.",2014,2018,0,0,0,2,2,3,,,5/20/2021 14:06:39,,1/1/2014 0:00:00,2,,1
26,"Salda - Atlantic Bank Swallows","Salda",11,221,"Studying foraging and roosting habitat selection in Bank Swallows.","Studying foraging and roosting habitat selection in Bank Swallows.
Sarah Saldahana - Dalhousie University and Acadia University",2014,2015,0,0,0,2,2,3,,,5/20/2021 14:06:39,,1/1/2014 0:00:00,,,1
27,"Smith","PSmith",,236,"A wide variety of migratory shorebird projects focusing on Semipalmated Sanpipers and Red Knots.","A wide variety of migratory shorebird projects focusing on Semipalmated Sanpipers and Red Knots.

Dr. Paul Smith - Environment Canada",2014,2019,0,0,0,2,2,3,,,5/20/2021 14:06:39,,1/1/2014 0:00:00,3,,1
28,"Taylor - Petrels","TaylorPetrels",,103,"Foraging behaviour or Leach's Storm Petrels in Nova Scotia","Foraging behaviour or Leach's Storm Petrels in Nova Scotia - Acadia University",2013,2013,0,0,0,2,2,3,,,5/20/2021 14:06:39,,1/1/2013 0:00:00,,,1
29,"R5_SALS","R5_SALS2",,252,"Currently only winter/spring deployments on Saltmarsh Sparrow (SALS) in South Carolina",,2014,2017,0,0,0,2,2,3,,,5/20/2021 14:06:39,,1/1/2016 0:00:00,2,,1
30,"Range Tests","test",32,2,"Tags used for range tests, or not attached to organisms, but whose data are still ""real"".",,2014,2014,0,0,0,2,2,3,,,5/20/2021 13:54:39,,1/1/2014 0:00:00,,,1
31,"Louisiana SPDOR VHF Network","Louisiana SPDOR",,19965,"Louisiana Department of Wildlife and Fisheries' Statewide Detection for Organismal Research (SPDOR) VHF Network
","The Statewide Passive Detection for Organismal Research (SPDOR) VHF Network project expects to deploy 30 receiver stations within the Louisiana Coastal Zone and along major migration corridors through generous financial and/or field staff support from the Louisiana Wildlife and Fisheries Foundation, the Barataria-Terrebonne National Estuary Program, ConocoPhillips, USFWS Wildlife and Sport Fish Restoration Program, and the Louisiana Department of Wildlife and Fisheries.  

Current main objectives include:

1)	Develop and install coast-wide network of at least 30 land based, VHF telemetry receiver stations that may be utilized by multiple researchers, partners, and for multiple taxa by 30 June 2020; we expect several stations to be operational by fall 2019.
2)	Collaborate with at least one additional  partner to measure suitability of the network for non-avian taxa (e.g., bats, insects, etc.) by 30 June 2020

Note that our main goal is to assist fellow wildlife biologists by the creation and maintenance of the necessary infrastructure to fill the network gap along the northern Gulf of Mexico.
",2016,,0,0,0,2,2,3,,,5/20/2021 13:54:39,,1/1/2016 0:00:00,1,,1
32,"Dowling","Dowling",17,245,"Migratory season tracking of eastern red, hoary, and silver-haired bats to inform migration ecology and offshore wind development","Wind energy development is promoted by both governmental and nonprofit entities as an environmentally friendly alternative to greenhouse gas-emitting fossil fuels.  However, wind farms can have negative impacts on wildlife, including bats (GAO 2005).  A recent study estimated 600,000 bats were killed by wind power in the United States in 2012 (Hayes 2013).

The effects of wind development on bat populations may be especially detrimental to migratory tree and foliage-roosting bats, which comprise about 75% of all fatalities reported in North America (Arnett et al. 2008).  In the northeastern United States, long-distance migrants include the hoary bat (Lasiurus cinereus), the eastern red bat (L. borealis), and the silver-haired bat (Lasionycteris noctivagans).  These species face the greatest risks during their fall migration southward, with mortality at wind farms peaking during this season (Arnett et al. 2008).  Little is known about the timing, routes, or drivers of migration in these species, or why they are particularly vulnerable to wind farm mortality during fall migration.  

Major bat migratory pathways in the northeastern U.S. have not been identified, but songbirds often follow coastal routes during migration, and it has been hypothesized that North American bats may follow similar pathways (Cryan 2003, Johnson et al. 2011).  Recent acoustic surveys in the Gulf of Maine have found activity of migratory bat species to be higher in coastal areas compared to inland sites (Stantec 2012), supporting the idea that coastal areas may serve as migratory pathways.  

This study will take advantage of the automated telemetry station network, in order to monitor late summer and fall movements of migratory bat species.  The goals of this research are 1) to monitor the coastal and offshore movements of migratory bats along the Eastern Seaboard, 2) to better characterize bat migration, including timing of movements, stopover, etc., and 3) to analyze diets of coastal migratory bats, to explore whether insect populations may serve as a driver of migration.  A better understanding of bat migration can greatly improve our knowledge of how populations will react to wind development, as well as inform minimization efforts and wind energy regulation. 
",2014,2016,0,0,0,2,2,3,,,5/20/2021 14:06:39,,1/1/2014 0:00:00,,,1
33,"Ernst","Ernst",19,247,"Fall deployments on Saltmarsh Sparrows in Rhode Island","Saltmarsh Sparrows
Nick Ernst - USFWS",2016,,0,0,0,2,2,3,,,5/20/2021 14:06:39,,1/1/2016 0:00:00,2,,1
34,"Gratto","Gratto",15,243,"Piping Plover post-breeding dispersal in Nova Scotia.","Piping Plover post-breeding dispersal in Nova Scotia.
Cheri Gratto-Trevor - Environment Canada",2014,2014,0,0,0,2,2,3,,,5/20/2021 14:06:39,,1/1/2014 0:00:00,,,1
35,"Powdermill Nature Reserve","PARC",13,407,"Studies investigating stopover ecology of migrant songbirds at Carnegie Museum of Natural History's Powdermill Avian Research Center (PARC).",,2016,2021,0,0,0,2,2,3,,,5/20/2021 14:06:39,,1/1/2016 0:00:00,1,,1
36,"Chickadee natal dispersal and social behavior","UOLavalBCCH",,235,"PIs: Julie Morand-Ferron (U of Ottawa), Andre Desrochers (U Laval).
Establishment of juvenile Black-capped Chickadees in winter flocks.
","We want to understand the links between natal dispersal and the establishment of social relationships by juvenile Black-capped Chickadees (Poecile atricapillus) once they settle into winter flocks. We wish to determine whether social establishment patterns differ betwen periurban and agriculture-dominated landscapes.

MOTUS will help us track the dispersal of young BCCH from natal territory to their wintering grounds. We hope to make effective use of a whip antenna connected to a SensorGnome aboard a vehicle as a first step to zero in on those elusive dispersers.

As a pilot project, four BCCH were fitted with coded transmitters on 8 September 2016, in a wooded area on the southern edge of the greater Ottawa region. The pilot project was inconclusive, and the project is put on hod for now. (Last update 28 June 2017)
",2016,2016,0,0,0,2,2,3,,,5/20/2021 14:06:39,,1/1/2016 0:00:00,,,1
37,"Wheeler - Loggerhead Shrike","OntLOSH",16,571,"Captive bred Loggerhead Shrike experiment.","Wildlife Preservation Canada has been coordinating the captive-breeding and release program for Loggerhead Shrike in Ontario since 2003.  PVAs have indicated that overwinter survival of hatch-year and second-year birds is the most sensitive factor in determining the population trend, suggesting that the main threats to our Ontario population may lie either on the wintering grounds, or along the migratory routes.  This information is the main information gap that exists for the species in Ontario, so WPC has started to deploy radio tags on captive-bred juveniles prior to release, to track their migratory movements and locate wintering grounds. ",2014,2019,0,0,0,2,2,3,,,5/20/2021 14:06:39,,1/1/2014 0:00:00,1,,1
38,"James Bay Shorebirds","JamesBay",,317,"Multi-agency shorebird monitoring on the western coast of James Bay.","Collaborative monitoring and research on shorebirds is being conducted by the Royal Ontario Museum, the Ontario Ministry of Natural Resources, Bird Studies Canada, Trent University, and the Canadian Wildlife Service and in conjunction with a larger conservation initiative involving James Bay First Nations and Nature Canada. Although the monitoring and research project will focus on shorebirds, the partner agencies will conduct related work on other migratory birds, other wildlife, and habitats on the James Bay coast.
Project Goals:
-To improve indices of abundance that may be used to monitor trends in shorebird populations staging along the western James Bay coast;
-To improve our understanding of spatial and temporal patterns of habitat/resource use and potential causes for their variation;
-To improve  identification of important shorebird staging habitats based on recent shorebird research and traditional ecological knowledge;
-To recommend protection of habitat, and nomination of WHSRN site(s) for western James Bay if supported by the data and required; and
-Further, to gain information on the migration and staging ecology of the Red Knot leading to protection of habitat from damage and destruction under the provincial Endangered Species Act.

Annual Objectives: 
-Quantify use of known Red Knot foraging and roosting locations;
-Use known staging area data to predict other staging areas along the James Bay coast and determine their use by shorebirds;
-Estimate the numbers and monitor temporal patterns of southbound migration of all shorebird species, including phenology of adults and juveniles;
-Identify and where possible delineate foraging areas and roosts used by staging shorebirds  ;
-Estimate annual variation in indices of abundance of staging shorebirds;
-Determine habitat use by shorebirds at the project survey sites; and
-Identify and record marked individuals (e.g., nanotags, leg flags and alphanumeric codes).",2014,2019,0,0,0,2,2,3,,,5/20/2021 14:06:39,,1/1/2014 0:00:00,3,,1
39,"Nol/Parada- Blackpoll Warbler Migration","NolBLPW",2,278,,,2014,2015,0,0,0,2,2,3,,,5/20/2021 14:06:39,,1/1/2014 0:00:00,,,1
40,"EC - Arctic Shorebirds","BurntPoint",3,654,"Collective of stations throughout the Canadian arctic and subarctic in support of shorebird ecology research.","Collaborative shorebird breeding ecology and migration project in Canadian arctic and flyways.
Dr. Paul Smith - Environment Canada
Dr. Erica Nol - Trent University
Dr. Rod Brook - Ontario Ministry of Natural Resources and Forestry
Lisa Pollock - Ontario Ministry of Natural Resources and Forestry

with

Laura Koloski
Lisa Kennedy
Sarah Neima
Scott Flemming",2016,2019,0,0,0,2,2,3,,,5/20/2021 14:06:39,,1/1/2014 0:00:00,,,1
41,"Max Planck ","Vorneweg",4,552,"Bat Tracking","
",2016,,0,0,0,2,2,3,,,5/20/2021 13:54:39,,1/1/2016 0:00:00,,,1
42,"Tremblay - Boreal Woodpeckers as forest indicators","Tremblay",7,234,"To be completed by PI","To be completed by PI",2016,2016,0,0,0,2,2,3,,,5/20/2021 14:06:39,,1/1/2014 0:00:00,,,1
43,"Eastern Shore of Virginia National Wildlife Refuge","Denmon",22,249,"1 Motus Station maintained by ESV - NWR - USFWS","1 Motus Station maintained by ESV - NWR - USFWS
Pam Denmon - USFWS ",2016,2017,0,0,0,2,2,3,,,5/20/2021 14:06:39,,1/1/2014 0:00:00,2,,1
45,"Merlin","AdamSmith",25,447,"Digitally-coded tags on southward migrating Merlins captured during fall on Block Island, Rhode Island ","Digitally-coded tags on southward migrating Merlins captured during fall on Block Island, Rhode Island",2014,2016,0,0,0,2,2,3,,,5/20/2021 14:06:39,,1/1/2014 0:00:00,1,,1
46,"Stutchbury - Ontario Wood Thrush","OntWOTH",27,474,"Survival, dispersal, and on-set of migration for juvenile and adult Wood Thrush.","Survival, dispersal, and on-set of migration for juvenile and adult Wood Thrush.",2016,2019,0,0,0,2,2,3,,,5/20/2021 14:06:39,,1/1/2016 0:00:00,1,,1
47,"Red Knot Staging and Migration Ecology","Niles",28,256,"Stopover and migration ecology of Red Knots at Delaware Bay, NJ.","The Red Knot (rufa subspecies) suffered remarkable declines in the last two decades. As part of a large international research and conservation effort, this study is investigating the staging ecology, migration timing and routes of Red Knots from critical sites across eastern North America including Delaware Bay - New Jersey, Mignan Archipelago - Quebec, James Bay - Ontario, Nelson River Estuary - Manitoba, and Southampton Island - Nunavut. Researchers are learning how long knots are using each of these critical areas and how fast they are moving between them. Southbound also migrants made important use of the Atlantic Coast in the United States including Cape Cod, Massachusetts, and New Jersey.  These stopover sites are vitally important for birds preparing for their long distance south bound flight to northern Brazil and Argentina/Chile - Tierra del Fuego.

The animation available here - http://motus-wts.org/data/demo/redKnotDetections2014.html -  shows a sample of relatively fast, <3 day duration, movements of Knots across the landscape.

Research Team: Environment Canada, New Jersey Fish and Wildlife, Conserve Wildlife Foundation of New Jersey. 

PI's
Dr. Paul Smith
Dr. Larry Niles 
Dr. Amanda Dey
",2014,2021,0,0,0,2,2,3,,,5/20/2021 14:06:39,,1/1/2014 0:00:00,9,,1
48,"Northeast Motus Collaboration","NE-Motus",,260,"A collaborative effort expanding inland Motus receiver locations throughout the Northeastern United States in support of all projects.","The Northeast Motus Collaboration is a cooperative effort between the Willistown Conservation Trust, Project Owlnet, the Ned Smith Center for Nature and Art, and the Carnegie Museum of Natural History to increase the coverage of the Motus based network of telemetry receiving stations in the interior of the Northeastern United States.

David Brinker and Scott Weidensaul",2014,2021,0,0,0,2,2,3,,,5/20/2021 14:06:39,,1/1/2014 0:00:00,1,,1
