"id","project_name","project_code","sg_id","lead_user_id","description_short","description","start_year","end_year","is_private_sensor","is_private_tag","is_private_project","tags_permissions","sensors_permissions","access_level","status","backup_id","last_edited_dt","last_edited_user_id","created_dt","fee_id","securable_bin","cite_by"
194,"Common Nighthawk/Eastern Whip-poor-will","GrahameNightjars",,3808,"Investigating breeding ground survival, departure dates, and migratory connectivity for Common Nighthawks and Eastern Whip-poor-wills breeding in ON.","Common Nighthawks and Eastern Whip-poor-wills are declining precipitously throughout their respective ranges, and if either or both species face an ecological trap, identifying it will be crucial in mitigating conservation efforts. Nighthawks and whip-poor- wills are migratory, crepuscular, cryptic ground-nesting birds that belong to the nightjar family. Breeding Bird Survey data from 1966-2011 indicate that Common Nighthawk numbers have dropped by -2.2%/year across their summer range (Sauer et al. 2013), and provincial and national trends from 2002-2012 show that in Canada, Eastern Whip-poor-wills are declining at a rate between -2.77%/year and -5.53%/year (Environment Canada 2015). Both nightjars are listed as threatened under the Species at Risk Act, but given their secretive nature and relative difficulty of researching nightjars, knowledge gaps have prevented us from pinpointing a direct cause of these declines. The primary objective of the proposed research is to investigate the potential influence of roadways on Common Nighthawk and Eastern Whip-poor-will breeding success and increase our understanding of factors driving their range- wide declines. My goals include improving methods for nightjar nest-monitoring and conservation of both species. Given the aforementioned aspects of nighthawk and whip-poor-will breeding ecology combined with numerous possible attractive features of roadways, it is impossible to overlook the potential threats to survival posed by even a single high-speed road cutting through otherwise appropriate habitat. We hypothesize that roadways bisecting breeding habitat for the Common Nighthawk and Eastern Whip-poor-will may present an ecological trap either in the classical sense, where adults erroneously favour poor-quality habitat near roadway edges over more suitable open woodlands and suffer reduced fitness as a result, or alternatively as an equal preference trap where nighthawks and whip-poor-wills in close proximity to roadways experience consequences to fitness from which those remaining in the habitat interior are exempt. Conversely, nighthawks and whip-poor-wills may be able to recognize the poorer quality of roadside habitats and avoid them altogether, resulting in much higher density of nighthawks and whip-poor-wills located a significant distance from the road’s edge.
Objectives:
Obtain refined knowledge of territory size and movements on Common Nighthawks and Eastern Whip-poor-wills on breeding grounds in Ontario
First known-fate study of Common Nighthawk and Eastern Whip-poor-will nestlings through the post-fledging period
Collect data on potential anthropogenic threat (high-speed roadways) to Common Nighthawk and Eastern Whip-poor-will reproductive success
Information gained will help to augment strategies for conservation managment and mitigation of species decline",2018,2021,0,0,0,2,2,3,,,5/20/2021 14:06:39,,6/4/2018 16:31:37,1,2,1
195,"Breeding habitat of Chimney Swift in Québec","Habitat-ChimneySwift",,234,,,2018,2020,0,0,0,2,2,3,,,5/20/2021 14:06:39,,6/5/2018 19:27:03,3,,1
196,"Fire Island PIPL Fledgling Survival and Migration","Fire_Island_PIPL",,3797,"Tracking fledgling piping plovers to document sources of pre-migration mortality and identify stopover locations.","We are deploying nanotags on near-fledgling piping plover chicks to document their movements and sources of mortality following fledge. We will be tracking individuals daily until they leave their natal grounds. Following their departure, we aim to identify stopover locations/durations during fall migration.",2018,2018,0,0,0,2,2,3,,,5/20/2021 14:06:39,,6/11/2018 16:54:39,,,1
197,"Taylor - Swallows","TaylorSwallows",,3900,"Tracking of the post-breeding and early migratory movements of Bank, Barn, Cliff and Tree Swallows from breeding sites in New Brunswick.",,2018,2019,0,0,0,2,2,3,,,5/20/2021 14:06:39,,6/11/2018 17:07:45,1,,1
198,"Prothonotary Warbler Migration","PROW_Mig",,3456,"Prothonotary Warbler nanotags deployments will build upon a growing network of migration research on this species.","Prothonotary Warbler nanotags deployments will build upon a growing network of migration research on this species.",2018,2019,0,0,0,2,2,3,,,5/20/2021 14:06:39,,6/22/2018 15:12:21,1,,1
199,"Ontario Bank Swallows 2018","BANS2018",,365,"Transmitters being placed on 100 bank swallow fledglings to measure survival.","Transmitters being placed on 100 bank swallow fledglings to measure survival.",2018,2021,0,0,0,2,2,3,,,5/20/2021 14:06:39,,6/25/2018 15:03:28,1,,1
200,"Ontario Thrush Migration","ON SWTH GCTH Motus",,365,"SWTH and GCTH tagged on northern Bruce Peninsula in partnership with Bruce Peninsula Bird Observatory.","SWTH and GCTH tagged on northern Bruce Peninsula in partnership with Bruce Peninsula Bird Observatory.  Study to determine stopover behavior and delineate migration routes in Ontario.",2017,2019,0,0,0,2,2,3,,,5/20/2021 14:06:39,,6/25/2018 15:21:07,,,1
201,"Purple Martin","PUMA",,2578,"Purple martin migratory movements from  Manitoba, ON","Purple martin migratory movements from  Manitoba, ON",2018,2018,0,0,0,2,2,3,,,5/20/2021 14:06:39,,6/28/2018 21:37:31,,,1
202,"Darner Migration","Darner",,2578,,,2018,2018,0,0,0,2,2,3,,,5/20/2021 14:06:39,,6/28/2018 21:39:06,,,1
203,"Landscape connectivity in Ontario bats","ON_bats",,4662,"Movement of little brown bats from maternity sites to swarming sites","Tracking the movement patterns of little brown bats and big brown bats from summer maternity colonies. We hope to determine the direction travel and specific routes to swarming sites/areas.",2018,2019,0,0,0,2,2,3,,,5/22/2021 16:17:16,,7/14/2018 16:58:56,1,2,1
204,"GTA Bat Tracking","GTA_bats",,4670,"Tracking bats to locate roosts and foraging areas within the Greater Toronto Area.","We will be tracking bats primarily to locate roosts and foraging areas within the Greater Toronto Area. This project will focus on Canadian Federal Species at Risk, with some opportunistic tagging of other species. We will primarily track bats during the breeding season, but may tag later in the season to look for seasonal migrations. ",2020,2020,0,0,0,2,2,3,,,5/20/2021 14:06:39,,7/17/2018 5:14:53,1,,1
205,"Colorado State SWHA","CO_SWHA",,4980,"Using Motus to determine exact timing of Swainson's Hawk arrival in California.","Station setup and Swainson's Hawk tagging to determine how territory habitat type influcences the time between arrival and nest initiation, run by Colorado State University.",2018,2019,0,0,0,2,2,3,,,5/20/2021 14:06:39,,7/22/2018 19:40:56,1,,1
206,"Painted Bunting spatial use and migration patterns","UNT_PABU",,6160,"Documenting the movements, territory and home range sizes of Painted buntings on their north Texas breeding grounds, and southward migration patterns.","We propose to document movements, territory and home range sizes of Painted Buntings on their north Texas breeding grounds and provide additional information on southward migration patterns.  Specifically, we propose to attach nanotags to a sample of Second Year and After Second Year male Painted Buntings and document their home range and territory sizes.  Based on the female mimicry hypothesis, we plan to test the prediction that SY males should range relatively widely by visiting multiple Painted Bunting territories, whereas ASY males should confine their movements primarily to within their home territories.

Further, by using nanotags as part of the MOTUS system we will be able to answer several questions related to Painted Bunting southward migration.  We have an established automated MOTUS receiving station at our study area, the Lewisville Lake Environmental Learning Area (LLELA).  Thus, the MOTUS system should allow us to detect nanotagged Painted Buntings daily as long as they remain on their breeding territories.  As soon as a signal is not detected, we should be able to determine the exact day or evening that individual Painted Buntings initiated migration.  There are also 18 automated MOTUS receiving systems located along the Gulf Coast from Galveston to Brownsville, Texas, 500-900 km south and southeast of our LLELA study area.  If our nanotagged Painted Buntings migrate more-or-less directly southward to the Gulf Coast, the MOTUS stations on the Gulf Coast have a relatively high probability of detecting our tagged birds.     
",2018,2021,0,0,0,2,2,3,,,5/20/2021 14:06:39,,7/24/2018 17:01:32,1,,1
207,"Barn Swallows Cambridge and Toronto Zoo","BARS Migration",,365,"Studying Barn Swallow post-breeding dispersal and migration from release sites in Cambridge and Toronto Zoo.","This is part of a larger tagging effort at 20 barns located ENE of Guelph, Ontario.",2018,2019,0,0,0,2,2,3,,,5/20/2021 14:06:39,,7/25/2018 18:53:50,3,,1
208,"Ontario Thrush Migration 2018","Thrush 2018",,365,"Project aimed at determining migration routes and stopover behavior of GCTH and SWTH through SW Ontario.","Project aimed at determining migration routes and stopover behavior of GCTH and SWTH through SW Ontario.  In partnership with BPBO and Phil Taylor at Acadia University.",2018,2019,0,0,0,2,2,3,,,5/20/2021 14:06:39,,7/26/2018 13:15:15,,,1
209,"WX MOBU Neonic 2018","WX_MOBU",,2555,"We will outfit monarch butterflies with nanotags to determine the effect of the pesticide clothianidin on navigation and orientation.","Monarch butterflies will be reared on milkweed treated with a low and high dose of the pesticide clothianidin. Once pupated, adult butterflies will be released with nanotags to monitor the migration of the butterflies on their journey south to the overwintering grounds. Our aim will be to determine if this agricultural pesticide impacts navigation and orientation in this species at risk. We will also be assessing the detectability of the nanotags (NTQB2-1) at varying distances from towers.",2018,2018,0,0,0,2,2,3,,,5/20/2021 14:06:39,,7/26/2018 18:49:22,,,1
210,"Missouri Motus Network","MOtus",,5191,"Placing Motus receivers in Missouri.","Building Motus receiver infrastructure in two latitudinal arrays across north and south Missouri as part of strategic, regional Motus network expansion.",2018,2018,0,0,0,2,2,3,,,5/20/2021 14:06:39,,7/27/2018 19:05:43,1,,1
211,"SE Norwegian Coastline Passerines","Norway_passerine",,5245,"Passerine migration behavior: tracking migration routes along the SE Norwegian coastline and use of area upon departure.",,2018,2020,0,0,0,2,2,3,,,8/2/2021 7:07:31,,7/31/2018 15:24:03,1,1,1
212,"Lake Superior Migration","LakeSuperiorMig",,6075,"Lake Superior tracking network",,2018,2021,0,0,0,2,2,3,,,5/20/2021 14:06:39,,8/15/2018 15:05:10,1,,1
213,"Intermountain West Collaboration - Birds","IWC birds",,6684,"Intermountain West Flyway: Motus station network and collaborative bird research.","Intermountain West Flyway: Motus station network and collaborative bird research.
Anyone interested in collaborative work to install and manage MOTUS stations or to deploy nanotags on birds, please contact William Blake @MPG Ranch.",2018,2021,0,0,0,2,2,3,,,9/7/2021 20:58:27,,8/20/2018 20:46:27,1,2,1
214,"Movement Ecology of Finches in Australia 2018","Wyndham Finches 2018",,2508,"Influence of fire of the movement behaviour of Gouldian and Long-tailed Finches in north-western Australia.",,2018,2018,0,0,0,2,2,3,,,5/20/2021 14:06:39,,8/22/2018 0:44:55,,,1
215,"SEFI - Receiver Station","SEFI",,2646,"Receiver station on South East Farallon Islands. Specializing in vagrancy and orientation. Non-continuous MOTUS listening frequency.","Receiver station on South East Farallon Islands. Specializing in vagrancy and orientation. Non-continuous MOTUS listening frequency.",2018,,0,0,0,2,2,3,,,5/20/2021 14:06:39,,8/24/2018 1:51:58,,,1
216,"Skagen Bird Observatory - Receiver Station","Skagen",,2646,"Receiver station situated on northern tip of Denmark. Autumn migration of passerines from Oslo Fjord and spring migration/ecological barrier studies","Receiver station situated on northern tip of Denmark. Autumn migration of passerines from Oslo Fjord and spring migration and ecological barrier studies.  ",2020,2020,0,0,0,2,2,3,,,5/20/2021 14:06:39,,8/24/2018 1:53:19,1,,1
217,"Lifewatch Belgium","Lifewatch",,7192,"LifeWatch Belgium develops and maintains a marine observatory including sensor networks. We aspire for automated data collection and data processing.","The Belgian LifeWatch project is part of the European LifeWatch infrastructure. LifeWatch was established as part of the European Strategy Forum on Research Infrastructure (ESFRI) and can be seen as a virtual laboratory for biodiversity research. VLIZ is constructing within Lifewatch Belgium a marine observatory to collect long term data from every ecosystem component, including bats.",2018,,0,0,0,2,2,3,,,5/20/2021 14:06:39,,8/28/2018 18:51:41,,,1
218,"BIRDMOVE - Autumn songbird migration 2018","BIRDMOVE_Autumn2018",,2340,"Songbirds tagged at the coast of Schleswig-Holstein (Germany) during autumn 2018",,2018,2018,0,0,0,2,2,3,,,5/20/2021 14:06:39,,9/4/2018 7:12:44,1,,1
219,"BIRDMOVE - Dunlin migration across the North Sea","BIRDMOVE_Dunlins",,2340,"Dunlin migration across the North Sea",,2018,2019,0,0,0,2,2,3,,,5/20/2021 14:06:39,,9/4/2018 9:44:22,1,,1
220,"UQO toit","UQO",,8310,"Antenna setup on the roof of the main building of UQO (Université du Québec en Outaouais).  Deployed and activate on July 17, 2019.","Antenna setup on the roof of the main building of UQO (Université du Québec en Outaouais).
Remerciements: 
Organisme de financement: Table régionale de gestion intégrée des ressources et du territoire de l’Outaouais
Organisme de soutien: Club des ornithologues de l'Outaouais
Partenaire: Université du Québec en Outaouais (Manon Moreau, gestion des installations, et François Lorenzetti, professeur-chercheur
Gestionnaires du projet: Gérard Desjardins (Environnement Sterne) et Frédéric Bédard (Club des ornithologues de l'Outaouais)
",2018,,0,0,0,2,2,3,,,5/20/2021 14:06:39,,9/10/2018 20:01:27,,,1
221,"Migratory behavior of SWTH in Western Washington","WA_SWTH",,8296,"The goal of this project is to track spring migratory movements and post-breeding movements of Swainson’s Thrush in Western Washington.  ","The goal of this project is to track spring migratory movements and post-breeding movements of Swainson’s Thrush in Western Washington.  ",2019,2019,0,0,0,2,2,3,,,5/20/2021 14:06:39,,9/12/2018 21:48:17,1,,1
222,"CTT Delaware Bay Sanderling","CTTDelBaySAND",,3507,"Dual-mode Motus towers in Delaware Bay",,2017,2018,0,0,0,2,2,3,,,5/20/2021 14:06:39,,9/17/2018 18:15:07,1,,1
223,"Baltic Sea Motus Network","Baltic",,9073,"Array of receivers on the Swedish and Finnish coast of the Baltic Sea. Coordinated by Ottenby Bird Observatory.","Under development. The Baltic Sea is a barrier for migratory birds and bats breeding or passing through Scandinavia. In this project we are building a network of towers in Sweden and Finland, providing an infrastructure to study migration and movements. For birds, the focus has so far been on stopover ecology of Eurasian nightjars and yellow-browed warblers in autumn, but the system can be used for many other species. Another important part of the project is to study the migration of bats between Finland and Sweden.",2019,2020,0,0,0,2,2,3,,,5/20/2021 14:06:39,,9/18/2018 15:28:50,1,,1
224,"CTT Montezuma NWR Tree Swallows","CTTMontezumaTRES",,3507,"Tree Swallow tagging with life tags at two dual-mode Motus towers in New York at Montezuma NWR ",,2017,2019,0,0,0,2,2,3,,,5/20/2021 14:06:39,,9/18/2018 19:06:02,1,,1
225,"Connecticut Audubon Society receiver stations","DPFhs",,10244,"General migration monitoring","Antenna host site at CT Audubon Society Deer Pond Farm Sanctuary in Sherman and FirstLight Power's Shepaug Dam in Southbury, Connecticut, USA",2018,,0,0,0,2,2,3,,,5/20/2021 14:06:39,,10/24/2018 17:04:22,1,,1
226,"Intermountain West Collaboration - Bats","IWC Bats",,6684,"Intermountain West Flyway: Motus station network and collaborative bat research.","Intermountain West Flyway: Motus station network and collaborative bat research.
Anyone interested in collaborative work to install and manage MOTUS stations or to deploy nanotags on bats, please contact William Blake @MPG Ranch.",2018,2019,0,0,0,2,2,3,,,5/20/2021 14:06:39,,10/29/2018 21:16:19,,,1
227,"Bird Migration Tracking of Offshore area in Taiwan","BMTOT",,11992,"Study how migratory birds move in the coastal area in West Taiwan.","Study how migratory birds move in the coastal area in West Taiwan.",2018,2020,0,0,0,2,2,3,,,5/20/2021 14:06:39,,11/12/2018 5:59:06,1,,1
228,"Louisiana Seaside Sparrow","LA_SESP",,12062,"Assessing Seaside Sparrow abundance, distribution, annual survivorship, and productivity in southwest Louisiana","NanoTag transmitters will be used to assess movements of Seaside Sparrows associated with various dispersal events.",2020,2020,0,0,0,2,2,3,,,5/20/2021 14:06:39,,11/14/2018 16:49:34,1,,1
229,"Brazil Purple Martin","BrazilPUMA",,2578,"Tagging and tracking of Purple Martins in Manaus and surrounding areas.","Dr. Kevin Fraser (University of Winnipeg), and Joe Siegrist (Purple Martin Conservation Association)",2018,,0,0,0,2,2,3,,,5/20/2021 14:06:39,,11/17/2018 14:50:12,1,,1
230,"Riverbanks Motus Tower","Riverbanks Motus",,12284,"Riverbanks Motus Tower","Motus tower in the Riverbanks Zoo Garden",2018,,0,0,0,2,2,3,,,5/20/2021 14:06:39,,11/20/2018 15:53:44,,,1
231,"American Tree Sparrows - Ontario","ATSP",,2672,"Winter ecology of American Tree Sparrows in Southern Ontario","The objectives of this study are to utilize several bird tracking technologies to answer some fundamental questions regarding habitat use, movement patterns and winter survivorship in this species. Specifically, we plan to use miniature light-level geolocators to better define the breeding range, migration routes, and migration timing of wintering American Tree Sparrows. While powerful, geolocators must be recovered from individual birds recaptured during a subsequent winter, and we will be extending considerable effort to recapture birds carrying geolocators. Given that return rates of birds between winters is quite low, we expect to only recover a small percentage of transmitters. To bolster our sample sizes and better define the breeding grounds for this species, we also plan to use stable isotopes from feathers. This method will allow us to define the regional breeding range for a much larger sample of birds, without the need to subsequently recapture birds. Finally, we also plan to attach coded transmitters (e.g. Nanotags) to a subset of birds as a means of tracking local bird movements during winter. Since Nanotags communicate with a dense external network of towers, once transmitters are deployed, birds do not have to be recaptured and transmitters do not have to be recovered to retrieve data. Nanotags can track bird movements at much finer spatial scales than geolocators, but their lifespan is much shorter. Through a combined approach, also using stationary and hand-held receivers and field observations, we plan to use these tracking technologies to further our understanding of movement and habitat use in this species. The goal of this project is to identify critical stages and locations within the annual cycle that, through conservation and management, lead to actions which slow or reverse population declines.",2019,2020,0,0,0,2,2,3,,,5/20/2021 14:06:39,,11/30/2018 20:40:16,3,,1
232,"Selva CAWA Colombia","CAWA_COL",,584,"Canada Warbler overwinter radio telemetry in Colombia","We are using Motus to estimate overwinter survival of Canada Warblers in three regions of the Colombian Andes",2015,2020,0,0,0,2,2,3,,,5/20/2021 14:06:39,,12/8/2018 17:35:50,9,2,1
233,"Craney Island Shorebird Migration Site","Craney Island",,12509,"Site location established to detect migrating shorebirds that use Craney Island facility in coastal Virginia","Site location established to detect migrating shorebirds that use Craney Island facility in coastal Virginia",2018,,0,0,0,2,2,3,,,5/20/2021 14:06:39,,12/14/2018 20:27:45,,,1
234,"WGLBBO - Wisconsin Subnetwork","WGLBBO Subnet",,21171,"Western Great Lakes Bird and Bat Observatory Inc. buildout of Motus stations in southern Wisconsin","A network of East-West and North to South stations across S.Wis and Lake Michigan shoreline to study nanotagged birds in migration.",2019,,0,0,0,2,2,3,,,5/20/2021 14:06:39,,1/3/2019 19:55:13,1,,1
235,"Biologic - BHP","BIOBHP",,2758,"An array in the NW of Western Australia","An array in the NW of Western Australia",2018,2020,0,0,0,2,2,3,,,5/20/2021 14:06:39,,1/7/2019 6:25:42,1,,1
236,"Biologic - RTIO","BIO-RTIO",,2758,"An array in the NW of Western Australia","An array in the NW of Western Australia",2018,2021,0,0,0,2,2,3,,,5/20/2021 14:06:39,,1/7/2019 6:28:01,1,,1
237,"Barn Swallows in Panjin, China","CNPJ",,14308,"Monitor barn swallows' activity in China.","I aim to use Motus Wildlife Tracking System to study the activity of breeding Barn Swallows (Hirundo rustica) in Panjin, China.",2019,,0,0,0,2,2,3,,,5/20/2021 14:06:39,,1/15/2019 7:45:54,,,1
238,"Vienna test","Vienna test",,2323,"Test of different antenna and receiver setups for use in different projects","Test of different antenna and receiver setups for use in different projects",2019,2019,0,0,0,2,2,3,,,5/20/2021 14:06:39,,1/22/2019 12:16:04,1,,1
239,"Brazil Non-Breeding Shorebirds","BrazilShorebirds",,219,"Tracking Shorebird Movements on Non-Breeding Grounds of Brazil","Tracking Shorebird Movements on Non-Breeding Grounds of Brazil",2019,2020,0,0,0,2,2,3,,,5/20/2021 14:06:39,,1/25/2019 15:43:02,3,,1
240,"ERI","Kent Farm",,15007,"Local Motus station at Kent Farm Research Station",,2020,2020,0,0,0,2,2,3,,,5/20/2021 14:06:39,,2/11/2019 18:19:36,1,,1
241,"Movement Ecology of Finches Australia 2019","AusFinch2019",,2508,,,2019,2019,0,0,0,2,2,3,,,5/20/2021 14:06:39,,2/20/2019 23:16:04,1,,1
242,"New Jersey wintering sparrows","NJ sparrows",,15271,,,2018,2019,0,0,0,2,2,3,,,5/20/2021 14:06:39,,2/21/2019 14:05:34,,,1
243,"Florida Aquarium","FLAQ",,12533,"Migratory bird tag tracking from the Florida Aquarium Center for Conservation","Migratory bird tag tracking from the Florida Aquarium Center for Conservation",2019,,0,0,0,2,2,3,,,5/20/2021 14:06:39,,2/26/2019 17:48:27,,,1
244,"Rookery Bay Reserve Migratory Network","RBR Migration",,21985,"This is an expansion of the South Florida MOTUS network. This data will be used to compliment pre-existing projects nationwide.","This tower will be used as an expansion of the South Florida network. Pre-existing projects will benefit from an additional source of movement data. This tower will be critical in documenting migratory shorebirds such as the black skimmer and red knot. Current black skimmer projects by Audubon Florida and FGCU will examine black skimmer movement.",2019,,0,0,0,2,2,3,,,5/20/2021 14:06:39,,3/8/2019 18:02:00,1,,1
246,"Clive Runnells Mad Island Marsh Preserve","Mad Island",,16113,"Spring migration stopover","Spring migration stopover banding and tagging by Smithsonian Migratory Bird Center.",2019,2021,0,0,0,2,2,3,,,5/20/2021 14:06:39,,3/19/2019 19:19:32,,,1
247,"Kern River Valley Tri-colored Blackbird Study","Kern TRBL",,16192,"This is a pilot study to document the movements of Tri-colored Blackbirds in the Kern River Valley, California.","The Tricolored Blackbird (Agelaius tricolor, TRBL) has suffered a long-term decline in abundance in California, including a 63% loss from 2008 to 2014, which led the California Fish and Wildlife Commission in April 2018 to list it as Threatened under the California Endangered Species Act (CESA). The status of TRBL is also currently under formal review for Federal listing under the Endangered Species Act.  Breeding by Tricolored Blackbirds in low elevation grasslands in the foothills surrounding California’s Central Valley (“foothill grasslands”) has been well documented but relatively little is known about these populations.  Ariola (et al. 2015) estimated that 30% of the state’s TRBL population occurs in these areas.  However, there is insufficient data on the movements of these birds, including whether these populations are year-long residents, migrants, or a mix of both.  In the Kern River Valley, some of the birds also appear to shift breeding sites during the breeding season.  We plan to fit 30 TRBLs (from at least two separate colonies) with nanoTags to track their movements within the Kern River Valley.  We hope to continue and expand this study in future years to track the movements of TRBLs throughout the area.",2019,2020,0,0,0,2,2,3,,,5/20/2021 14:06:39,,3/21/2019 18:36:46,1,,1
248,"CTA - James Bay Array","CTA_JamesBay",,547,"An array of receivers along the eastern portion of James Bay. Operated by the Cree Trappers Association.",,2019,,0,0,0,2,2,3,,,5/20/2021 14:06:39,,3/31/2019 17:29:16,,,1
